{
  "schema_version": "aidl.language-surface/v1",
  "contract_revision": 2,
  "authority": "M10.1",
  "status": "frozen",
  "canonical_form": "[export] <kind> <name?> [(named-args)] [-> type] { slots }",
  "declaration_kinds": [
    {"kind":"app","disposition":"canonical","name_policy":"required","export_allowed":true,"header_args_occurrence":{"min":0,"max":1},"header_args":[],"result_type":false,"body_slots":[{"id":"profile","visible_keyword":"profile","name_policy":"required","occurrence":{"min":1,"max":null},"order":"source","unique":true,"value_mode":"block","nested_slots":[{"id":"version","visible_keyword":"version","name_policy":"none","occurrence":{"min":1,"max":1},"order":"canonical","unique":true,"value_mode":"literal","literal_kind":"integer"}]}],"legacy_forms":[]},
    {"kind":"auth","disposition":"canonical","name_policy":"none","export_allowed":true,"header_args_occurrence":{"min":0,"max":1},"header_args":[],"result_type":false,"body_slots":[],"legacy_forms":[]},
    {"kind":"a11y","disposition":"canonical","name_policy":"none","export_allowed":true,"header_args_occurrence":{"min":0,"max":1},"header_args":[],"result_type":false,"body_slots":[],"legacy_forms":[]},
    {"kind":"privacy","disposition":"canonical","name_policy":"none","export_allowed":true,"header_args_occurrence":{"min":0,"max":1},"header_args":[],"result_type":false,"body_slots":[],"legacy_forms":[]},
    {"kind":"enum","disposition":"canonical","name_policy":"required","export_allowed":true,"header_args_occurrence":{"min":0,"max":1},"header_args":[],"result_type":false,"body_slots":[{"id":"case","visible_keyword":"case","name_policy":"required","occurrence":{"min":1,"max":null},"order":"source","unique":true,"value_mode":"enum_case"}],"legacy_forms":["bare enum cases separated by comma"]},
    {"kind":"alias","disposition":"canonical","name_policy":"required","export_allowed":true,"header_args_occurrence":{"min":0,"max":1},"header_args":[],"result_type":false,"body_slots":[],"legacy_forms":["opaque Name = Type"]},
    {"kind":"value","disposition":"canonical","name_policy":"required","export_allowed":true,"header_args_occurrence":{"min":0,"max":1},"header_args":[],"result_type":false,"body_slots":[],"legacy_forms":[]},
    {"kind":"union","disposition":"canonical","name_policy":"required","export_allowed":true,"header_args_occurrence":{"min":0,"max":1},"header_args":[],"result_type":false,"body_slots":[],"legacy_forms":[]},
    {"kind":"error","disposition":"canonical","name_policy":"required","export_allowed":true,"header_args_occurrence":{"min":0,"max":1},"header_args":[],"result_type":false,"body_slots":[],"legacy_forms":[]},
    {"kind":"entity","disposition":"canonical","name_policy":"required","export_allowed":true,"header_args_occurrence":{"min":0,"max":1},"header_args":[],"result_type":false,"body_slots":[{"id":"field","visible_keyword":"field","name_policy":"required","occurrence":{"min":0,"max":null},"order":"source","unique":true,"value_mode":"type_ref","type":{"kind":"named","optional":false,"name":"T"}},{"id":"index","visible_keyword":"index","name_policy":"required","occurrence":{"min":0,"max":null},"order":"source","unique":true,"value_mode":"block"}],"legacy_forms":["unprefixed field: Type modifiers"]},
    {"kind":"view","disposition":"canonical","name_policy":"required","export_allowed":true,"header_args_occurrence":{"min":0,"max":1},"header_args":[],"result_type":false,"body_slots":[],"legacy_forms":[]},
    {"kind":"api","disposition":"canonical","name_policy":"required","export_allowed":true,"header_args_occurrence":{"min":0,"max":1},"header_args":[],"result_type":false,"body_slots":[],"legacy_forms":[]},
    {"kind":"policy","disposition":"canonical","name_policy":"required","export_allowed":true,"header_args_occurrence":{"min":0,"max":1},"header_args":[],"result_type":true,"body_slots":[],"legacy_forms":[]},
    {"kind":"query","disposition":"canonical","name_policy":"required","export_allowed":true,"header_args_occurrence":{"min":0,"max":1},"header_args":[{"name":"parameters","occurrence":{"min":0,"max":1},"value_mode":"parameter_list","parameter":{"name_policy":"required","unique":true,"type":{"value_mode":"type_ref"},"modifiers":["default"]}}],"result_type":true,"body_slots":[{"id":"read","visible_keyword":"read","name_policy":"none","occurrence":{"min":0,"max":1},"order":"canonical","unique":true,"value_mode":"expression"}],"legacy_forms":["query name(params) -> Type"]},
    {"kind":"mutation","disposition":"canonical","name_policy":"required","export_allowed":true,"header_args_occurrence":{"min":0,"max":1},"header_args":[{"name":"parameters","occurrence":{"min":0,"max":1},"value_mode":"parameter_list","parameter":{"name_policy":"required","unique":true,"type":{"value_mode":"type_ref"},"modifiers":["default"]}}],"result_type":true,"body_slots":[],"legacy_forms":["mutation name(params) -> Type"]},
    {"kind":"event","disposition":"canonical","name_policy":"required","export_allowed":true,"header_args_occurrence":{"min":0,"max":1},"header_args":[],"result_type":false,"body_slots":[],"legacy_forms":[]},
    {"kind":"topic","disposition":"canonical","name_policy":"required","export_allowed":true,"header_args_occurrence":{"min":0,"max":1},"header_args":[],"result_type":false,"body_slots":[],"legacy_forms":[]},
    {"kind":"queue","disposition":"canonical","name_policy":"required","export_allowed":true,"header_args_occurrence":{"min":0,"max":1},"header_args":[],"result_type":false,"body_slots":[],"legacy_forms":[]},
    {"kind":"consumer","disposition":"canonical","name_policy":"required","export_allowed":true,"header_args_occurrence":{"min":0,"max":1},"header_args":[{"name":"topic","occurrence":{"min":1,"max":1},"value_mode":"declaration_ref","reference_kinds":["topic"]},{"name":"messageType","occurrence":{"min":1,"max":1},"value_mode":"type_ref","type":{"kind":"named","optional":false,"name":"T"}}],"result_type":false,"body_slots":[],"legacy_forms":["consumer Name on Topic from Event"]},
    {"kind":"projection","disposition":"canonical","name_policy":"required","export_allowed":true,"header_args_occurrence":{"min":0,"max":1},"header_args":[{"name":"sources","occurrence":{"min":1,"max":1},"value_mode":"type_ref","type":{"kind":"named","optional":false,"name":"T"}},{"name":"target","occurrence":{"min":1,"max":1},"value_mode":"declaration_ref","reference_kinds":["entity","resource","projection"]}],"result_type":false,"body_slots":[],"legacy_forms":["projection Name from [A,B] into Target"]},
    {"kind":"workflow","disposition":"canonical","name_policy":"required","export_allowed":true,"header_args_occurrence":{"min":0,"max":1},"header_args":[],"result_type":false,"body_slots":[],"legacy_forms":[]},
    {"kind":"saga","disposition":"canonical","name_policy":"required","export_allowed":true,"header_args_occurrence":{"min":0,"max":1},"header_args":[],"result_type":false,"body_slots":[],"legacy_forms":[]},
    {"kind":"task","disposition":"canonical","name_policy":"required","export_allowed":true,"header_args_occurrence":{"min":0,"max":1},"header_args":[],"result_type":false,"body_slots":[],"legacy_forms":[]},
    {"kind":"schedule","disposition":"canonical","name_policy":"required","export_allowed":true,"header_args_occurrence":{"min":0,"max":1},"header_args":[],"result_type":false,"body_slots":[],"legacy_forms":[]},
    {"kind":"system","disposition":"canonical","name_policy":"required","export_allowed":true,"header_args_occurrence":{"min":0,"max":1},"header_args":[],"result_type":false,"body_slots":[],"legacy_forms":[]},
    {"kind":"service","disposition":"canonical","name_policy":"required","export_allowed":true,"header_args_occurrence":{"min":0,"max":1},"header_args":[],"result_type":false,"body_slots":[],"legacy_forms":[]},
    {"kind":"client","disposition":"canonical","name_policy":"required","export_allowed":true,"header_args_occurrence":{"min":0,"max":1},"header_args":[{"name":"service","occurrence":{"min":1,"max":1},"value_mode":"declaration_ref","reference_kinds":["service"]}],"result_type":false,"body_slots":[],"legacy_forms":["client Name for Service"]},
    {"kind":"tenant","disposition":"canonical","name_policy":"required","export_allowed":true,"header_args_occurrence":{"min":0,"max":1},"header_args":[],"result_type":false,"body_slots":[],"legacy_forms":[]},
    {"kind":"channel","disposition":"canonical","name_policy":"required","export_allowed":true,"header_args_occurrence":{"min":0,"max":1},"header_args":[],"result_type":false,"body_slots":[],"legacy_forms":[]},
    {"kind":"resource","disposition":"canonical","name_policy":"required","export_allowed":true,"header_args_occurrence":{"min":0,"max":1},"header_args":[],"result_type":false,"body_slots":[],"legacy_forms":[]},
    {"kind":"media","disposition":"canonical","name_policy":"required","export_allowed":true,"header_args_occurrence":{"min":0,"max":1},"header_args":[],"result_type":false,"body_slots":[],"legacy_forms":[]},
    {"kind":"rendition","disposition":"canonical","name_policy":"required","export_allowed":true,"header_args_occurrence":{"min":0,"max":1},"header_args":[],"result_type":false,"body_slots":[],"legacy_forms":[]},
    {"kind":"sync","disposition":"canonical","name_policy":"required","export_allowed":true,"header_args_occurrence":{"min":0,"max":1},"header_args":[],"result_type":false,"body_slots":[],"legacy_forms":[]},
    {"kind":"migration","disposition":"canonical","name_policy":"required","export_allowed":true,"header_args_occurrence":{"min":0,"max":1},"header_args":[{"name":"fromVersion","occurrence":{"min":1,"max":1},"value_mode":"literal","literal_kind":"string"},{"name":"toVersion","occurrence":{"min":1,"max":1},"value_mode":"literal","literal_kind":"string"}],"result_type":false,"body_slots":[],"legacy_forms":["migration Name from \"a\" to \"b\""]},